name,address,website,tel,emails
Asbestos Solutions UK,"Unit 1 Altens Industrial Estate, Hareness Circle, Altens Industrial Estate, Aberdeen, AB123LY",http://www.asbestossolutionsuk.org,07565333160,
Quality Asbestos Services Ltd,"Unit 18-19 Balmacassie Commercial Centre, Ellon, AB418QR",http://www.qasltd.co.uk,01358729055,
Astec Consultants Ltd,"South Killyquharn, New Aberdour, Fraserburgh, AB436NA",,01224460101,
Strathmore Environmental Services Ltd,"Westacre, Meigle, Blairgowrie, PH128SE",http://www.sesltd.org.uk,01382549067,
Northern Asbestos Services Ltd,"14 Perimeter Road, Elgin, IV306AF",http://www.northernasbestos.co.uk,01343552650,
Asbestos Specialist UK,"36 Moycroft Road, Elgin, IV301XE",,01343548277,
N R C,"4 River Drive, Teaninich Industrial Estate, Alness, IV170PG",http://www.nrcc.com,01349884480,
Rod Munro Ltd,"Unit 4b Industrial Estate, Evanton, Dingwall, IV169XJ",http://www.rodmunroltd.com,08081414444,
