name,address,website,tel,emails
C & A Asbestos Removal Ltd,"Ael Y Garth, Y Felinheli, LL564QE",http://www.asbestosremovalwales.co.uk,1248670299,info@asbestosremovalwales.co.uk
Asbestos Solutions North Wales Ltd,"65 Bryn Cadno, Colwyn Bay, LL296DW",http://www.asbestosremoval.ltd,8000086009,info@asbesol.co.uk
Environmental Essentials,"Unit 5325 Cae Eithin, Abergele, LL228LJ",http://www.environmentalessentials.co.uk,3454569953,"enquiries@environmentalessentials.co.uk, dataofficer@environmentalessentials.co.uk"
Pilkington Asbestos Removal Services,"Unit 2-3 Glan Aber Trading Estate, Vale Road, Rhyl, LL182PL",http://www.parsltd.co.uk,1745350257,info@parsltd.co.uk
A & D Environmental Services Ltd,"E36 Ashmount Enterprise Park, Aber Road, Flint, CH65YL",http://www.ad-asbestosremoval.co.uk,1352734498,
